"item","rarity","enchantment","damage","damage_type","weight_kg","price_gp","shared_properties","shared_action","special","where_to_find","source_url"
"Light Hammer","Common","","1d4","Bludgeoning","0.9","40","One-Handed; Melee: 1.5 m (5 ft); Light; Thrown; Dippable","Concussive Smash","","","https://bg3.wiki/wiki/Light_Hammers"
"Light Hammer","Common","","1d4","Bludgeoning","0.9","40","One-Handed; Melee: 1.5 m (5 ft); Light; Thrown; Dippable","Concussive Smash","","","https://bg3.wiki/wiki/Light_Hammers"
"Rusty Light Hammer","Common","","1d4","Bludgeoning","0.9","3","One-Handed; Melee: 1.5 m (5 ft); Light; Thrown; Dippable","Concussive Smash","","Shadow-Cursed Lands X: -168 Y: 100: In one of the Selunite graves outside the Grand Mausoleum; Spotted an issue with this page? Leave a comment! Note that your IP address will be publicly logged unless you create an account. You can also edit the page to fix the issue. See How to Contribute to get started, and maybe join our Discord so we can coordinate our efforts.","https://bg3.wiki/wiki/Light_Hammers"
"Light Hammer +1","Uncommon","+1","1d4 + 1","Bludgeoning","0.9","40","One-Handed; Melee: 1.5 m (5 ft); Light; Thrown; Dippable","Concussive Smash","","Sold by any trader using the magic melee table","https://bg3.wiki/wiki/Light_Hammers"
"Shining Staver-of-Skulls","Uncommon","+1","1d4 + 1; 1d4","Bludgeoning; Radiant","0.9","65","One-Handed; Melee: 1.5 m (5 ft); Light; Thrown; Dippable","Concussive Smash","Light - This object has an aura of light with a radius of 7.5 m (25 ft).","Carried by Corsair Greymon while the party first travel on Gekh's raft across the lake to Grymforge; Sold by Corsair Greymon in Grymforge at X: -120 Y: -95 after the party sail there for the first time","https://bg3.wiki/wiki/Light_Hammers"
"Skybreaker","Uncommon","+1","1d4 + 1","Bludgeoning","0.9","65","One-Handed; Melee: 1.5 m (5 ft); Light; Thrown; Dippable","Concussive Smash","Searing Smite ( + ); Cast as a level 1 spell ( Recharge: Long rest.)","Arcane Tower X: 28 Y: -295: In a locked heavy chest in front of the entrance","https://bg3.wiki/wiki/Light_Hammers"
"Wulbren's Hammer","Uncommon","+1","1d4 + 1","Bludgeoning","0.9","65","One-Handed; Melee: 1.5 m (5 ft); Light; Thrown; Dippable","Concussive Smash","2d4Force damage against items and world objects (unlisted).","Moonrise Towers Prison X: 575 Y: -647: On a table up the ladder in the Warden's room","https://bg3.wiki/wiki/Light_Hammers"
