"item","rarity","enchantment","damage","damage_type","weight_kg","price_gp","shared_properties","shared_action","special","where_to_find","source_url"
"Maul","Common","","2d6","Bludgeoning","4.5","30","Two-Handed; Melee: 1.5 m (5 ft); Dippable","Backbreaker","","","https://bg3.wiki/wiki/Mauls"
"Pactbound Maul","Common","","2d6","Bludgeoning","4.5","0","Two-Handed; Melee: 1.5 m (5 ft); Dippable","Backbreaker","","Summoned by a Hexblade with Pact of the Blade: Maul","https://bg3.wiki/wiki/Mauls"
"Rusty Maul","Common","","2d6","Bludgeoning","4.5","3","Two-Handed; Melee: 1.5 m (5 ft); Dippable","Backbreaker","","On a large pile of discarded weapons and armour near the Rivington gate at X: 10 Y: -131; Spotted an issue with this page? Leave a comment! Note that your IP address will be publicly logged unless you create an account. You can also edit the page to fix the issue. See How to Contribute to get started, and maybe join our Discord so we can coordinate our efforts.","https://bg3.wiki/wiki/Mauls"
"Doom Hammer","Uncommon","","2d6","Bludgeoning","4.5","65","Two-Handed; Melee: 1.5 m (5 ft); Dippable","Backbreaker","Edge of Terror; Each strike fills the target with a chilling dread that prevents it from regaining hit points. Undead creatures also get Disadvantage on Attack rolls.","Goblin Camp X: -99 Y: 424: Sold by Grat the Trader","https://bg3.wiki/wiki/Mauls"
"Hamarhraft","Uncommon","","2d6","Bludgeoning","4.5","65","Two-Handed; Melee: 1.5 m (5 ft); Dippable","Backbreaker","Shockwave; When the wearer Jumps, they deal 1d4 Thunder damage in a 3 m (10 ft) radius upon landing.","Waukeen's Rest X: -85 Y: 631: in a gilded chest in one of the burning rooms on the top floor of the inn","https://bg3.wiki/wiki/Mauls"
"Maul +1","Uncommon","+1","2d6 + 1","Bludgeoning","4.5","40","Two-Handed; Melee: 1.5 m (5 ft); Dippable","Backbreaker","","Sold by any trader using the magic melee table; Spotted an issue with this page? Leave a comment! Note that your IP address will be publicly logged unless you create an account. You can also edit the page to fix the issue. See How to Contribute to get started, and maybe join our Discord so we can coordinate our efforts.","https://bg3.wiki/wiki/Mauls"
"Corpsegrinder","Rare","+2","2d6 + 2; 1d4","Bludgeoning; Thunder","4.5","190","Two-Handed; Melee: 1.5 m (5 ft); Dippable","Backbreaker","Grand Slam; Slam your weapon into the ground, dealing additional Thunder damage equal to your proficiency bonus, thunderously impacting nearby foes and possibly pushing them away. ( Recharge: Short rest.)","Western Beach X: -222 Y: 93: Carried by Cairos at the beaches west of Rivington","https://bg3.wiki/wiki/Mauls"
"Foebreaker","Very Rare","+2","2d6 + 2","Bludgeoning","4.5","480","Two-Handed; Melee: 1.5 m (5 ft); Dippable","Backbreaker","Lethal Weapon; This weapon ignores resistance to Bludgeoning damage.","Sorcerous Vault X: 326 Y: 998: in a hidden chest in the Karsus section","https://bg3.wiki/wiki/Mauls"
