"item","rarity","enchantment","damage","damage_type","weight_kg","price_gp","shared_properties","shared_action","special","where_to_find","source_url"
"Rusty Sickle","Common","","1d4","Slashing","0.9","1","One-Handed; Melee: 1.5 m (5 ft); Light; Dippable","Lacerate","","In the undercity ruins; Spotted an issue with this page? Leave a comment! Note that your IP address will be publicly logged unless you create an account. You can also edit the page to fix the issue. See How to Contribute to get started, and maybe join our Discord so we can coordinate our efforts.","https://bg3.wiki/wiki/Sickles"
"Pactbound Sickle","Common","","1d8","Slashing","0.9","0","One-Handed; Melee: 1.5 m (5 ft); Light; Dippable","Lacerate","","Summoned by a Hexblade with Pact of the Blade: Sickle","https://bg3.wiki/wiki/Sickles"
"Sickle","Common","","1d4","Slashing","0.9","10","One-Handed; Melee: 1.5 m (5 ft); Light; Dippable","Lacerate","","","https://bg3.wiki/wiki/Sickles"
"Sickle (Redcap)","Common","","2d4","Slashing","0.9","10","One-Handed; Melee: 1.5 m (5 ft); Light; Dippable","Lacerate","","Carried by Redcaps","https://bg3.wiki/wiki/Sickles"
"Sickle of BOOOAL","Rare","","2d4","Slashing","0.9","190","One-Handed; Melee: 1.5 m (5 ft); Light; Dippable","Lacerate","","The Festering Cove X: -417 Y: 284: Carried by Pooldripp the Zealous or given to the player character by BOOOAL","https://bg3.wiki/wiki/Sickles"
"Sussur Sickle","Rare","+1","1d4 + 1","Slashing","0.9","120","One-Handed; Melee: 1.5 m (5 ft); Light; Dippable","Lacerate","Silences the target on hit if it fails a DC 12 Constitution Saving Throw.","Blighted Village X: -477 Y: -378: Reward for completing the quest Finish the Masterwork Weapon","https://bg3.wiki/wiki/Sickles"
"Wavemother's Sickle","Rare","+2","1d4 + 2; 1d4","Slashing; Cold","0.9","190","One-Handed; Melee: 1.5 m (5 ft); Light; Dippable","Lacerate","Watery Guidance; This weapon has Advantage against Wet creatures.","Water Queen's House X: -229 Y: -261: Carried by Allandra Grey","https://bg3.wiki/wiki/Sickles"
