"item","rarity","enchantment","damage","damage_type","weight_kg","price_gp","shared_properties","shared_action","special","where_to_find","source_url"
"Pactbound Trident","Common","","1d6","Piercing","1.8","0","1d8 (1~8) + Strength modifier Piercing; Versatile; Melee: 1.5 m (5 ft); Thrown; Dippable","Rush Attack","","Summoned via Warlock's Pact of the Blade: Trident","https://bg3.wiki/wiki/Tridents"
"Rusty Trident","Common","","1d6","Piercing","1.8","4","1d8 (1~8) + Strength modifier Piercing; Versatile; Melee: 1.5 m (5 ft); Thrown; Dippable","Rush Attack","","On a large pile of discarded weapons and armour near the Rivington gate at X: 10 Y: -131; Spotted an issue with this page? Leave a comment! Note that your IP address will be publicly logged unless you create an account. You can also edit the page to fix the issue. See How to Contribute to get started, and maybe join our Discord so we can coordinate our efforts.","https://bg3.wiki/wiki/Tridents"
"Trident","Common","","1d6","Piercing","1.8","40","1d8 (1~8) + Strength modifier Piercing; Versatile; Melee: 1.5 m (5 ft); Thrown; Dippable","Rush Attack","","","https://bg3.wiki/wiki/Tridents"
"Trident +1","Uncommon","+1","1d6 + 1","Piercing","1.8","55","1d8 (1~8) + Strength modifier Piercing; Versatile; Melee: 1.5 m (5 ft); Thrown; Dippable","Rush Attack","","Sold by any trader using the magic melee table","https://bg3.wiki/wiki/Tridents"
"The Sparky Points","Rare","","1d6","Piercing","1.8","390","1d8 (1~8) + Strength modifier Piercing; Versatile; Melee: 1.5 m (5 ft); Thrown; Dippable","Rush Attack","Electric Blood; When the wielder deals damage using this weapon, they gain 2 Lightning Charges.","Waukeen's Rest X: -63 Y: 600: Rewarded by Counsellor Florrick for rescuing her from the burning inn during the quest Rescue the Grand Duke","https://bg3.wiki/wiki/Tridents"
"Trident +2","Rare","+2","1d6 + 2","Piercing","1.8","125","1d8 (1~8) + Strength modifier Piercing; Versatile; Melee: 1.5 m (5 ft); Thrown; Dippable","Rush Attack","","Carried by The Darkening Hunt in the final fight Atop the Netherbrain, if a ranger is in the party","https://bg3.wiki/wiki/Tridents"
"Trident of the Waves","Very Rare","+1","1d6 + 1","Piercing","1.8","630","1d8 (1~8) + Strength modifier Piercing; Versatile; Melee: 1.5 m (5 ft); Thrown; Dippable","Rush Attack","The Water Caller; On a hit, inflict Wet and create a 2 m / 7 ft Water surface centred around the target.","The Counting House X: -711 Y: 882: In the High Security Vault nº4","https://bg3.wiki/wiki/Tridents"
"Nyrulna","Legendary","+3","1d6 + 3; 1d6","Piercing; Thunder","1.8","840","1d8 (1~8) + Strength modifier Piercing; Versatile; Melee: 1.5 m (5 ft); Thrown; Dippable","Rush Attack","Zephyr Connection; This weapon will return to your hand when thrown. You cannot be forced to drop the trident. When thrown, the weapon creates an explosion that deals 3d4 ThunderDRS damage in a 6 m / 20 ft blast centered on the target.; Veil of the Wind; You gain a +3 m (10 ft) bonus to movement speed and jump distance. Equipping this weapon gives you Immunity to falling damage.; Nyrulna: Glowing; This object shines with a glowing light in a radius of 6 m / 20 ft.; Zephyr Flash; Rush forward, creating an air vortex that blasts foes and possibly inflicts Bleeding. ( Recharge: Short rest.); Zephyr Break; Zephyr Break imitates the effects of the spell Gust of Wind while dealing thunder damage. ( Recharge: Short rest.)","Jungle X: -1511 Y: -1522: In a locked painted chest, near the portal to exit the area","https://bg3.wiki/wiki/Tridents"
